{
  "binding_id": "TB-FIXTURE-VALID-001",
  "tool_registry": [
    {
      "tool_id": "skill.single-cell-rna-qc",
      "capability": "single-cell RNA QC",
      "surface": "skill",
      "invocation": "single-cell-rna-qc skill",
      "output_kind": "dataset_metadata",
      "provenance_fields": [
        "n_cells_pre",
        "n_cells_post",
        "mito_pct_cutoff",
        "doublet_method"
      ],
      "failure_modes": [
        "scrublet unavailable",
        "empty matrix"
      ],
      "downgrade_label": "plan-only"
    },
    {
      "tool_id": "skill.pydeseq2-differential-expression",
      "capability": "bulk RNA-seq DEG",
      "surface": "skill",
      "invocation": "pydeseq2-differential-expression skill",
      "output_kind": "table",
      "provenance_fields": [
        "design_formula",
        "reference_level",
        "shrinkage"
      ],
      "failure_modes": [
        "no replicates",
        "rank-deficient design"
      ],
      "downgrade_label": "plan-only"
    }
  ],
  "tool_call_ledger": [
    {
      "call_id": "C1",
      "tool_id": "skill.single-cell-rna-qc",
      "inputs_digest": "pbmc raw h5ad, 12k cells",
      "output_ref": "artifact://qc/adata_qc.h5ad",
      "status": "success",
      "provenance": [
        "n_cells_pre=12043",
        "n_cells_post=10981",
        "mito_pct_cutoff=15",
        "doublet_method=scrublet"
      ],
      "affected_claim_ids": [
        "H-qc-1"
      ],
      "iteration": 1
    },
    {
      "call_id": "C2",
      "tool_id": "skill.pydeseq2-differential-expression",
      "inputs_digest": "counts.csv, ~condition, ref=control",
      "output_ref": "artifact://deg/results.csv",
      "status": "success",
      "provenance": [
        "design_formula=~condition",
        "reference_level=control",
        "shrinkage=apeglm"
      ],
      "affected_claim_ids": [
        "H-deg-1"
      ],
      "iteration": 1
    }
  ],
  "tool_backed_claim_ids": [
    "H-qc-1",
    "H-deg-1"
  ]
}